{
  "$schema": "https://json-schema.org/draft/2020-12/schema",
  "$id": "https://portdaddy.dev/schemas/agent-harbor/v0/memory-episode.schema.json",
  "title": "MemoryEpisode",
  "description": "A distilled unit of agent memory extracted from the transcript store (binder ch04 memory tiers: recall/archival/graph; ch07 M6 'episodic memory extraction' + 'graph facts with validity intervals'). VALIDITY RULE (ADR-0097, normative): every episode carries a bi-temporal validity interval — validFrom/validUntil for when the fact held in the world, ingestedAt for when the system learned it (the Zep/Graphiti bi-temporal model per the episodic-memory-algorithms skill). validUntil is required-but-nullable so open-endedness is an explicit assertion, never an omission. CITATION RULE: 'a memory without a source is a suggestion, not a fact' (ch04 retrieval policy) — citations has minItems 1. DELETION RULE: sourcePayloadState implements the ch04 distilled-source contract — derived memory must not pretend a deleted raw source still exists; a consumer renders 'source payload deleted' when only a tombstone remains. Field names follow ADR-0095 fork resolution 1 (agentNodeId/sessionId/runId); superseded ch03/ch04-sketch names (agentId) must not reappear. Citation cross-field enforcement (kind=transcript-event requires transcriptEventId, etc.) is runtime, per the compaction-packet pattern.",
  "type": "object",
  "properties": {
    "schema": { "const": "pd.agent-harbor.memory-episode.v0" },
    "episodeId": { "type": "string", "minLength": 1 },
    "harborId": { "type": "string" },
    "tier": { "enum": ["core", "recall", "archival", "graph"], "description": "ch04 memory tier this episode belongs to. Blackboard is a separate read-model contract (blackboard-item.schema.json), not a tier here." },
    "agentNodeId": { "type": ["string", "null"], "description": "The agent the episode is about, when agent-scoped. Null for repo/project-scoped memory." },
    "sessionId": { "type": ["string", "null"], "description": "The session the episode was extracted from, when session-scoped." },
    "runId": { "type": ["string", "null"] },
    "scope": {
      "type": "object",
      "description": "What the memory attaches to for retrieval routing (ch04: project, repo, agent, or workgroup).",
      "properties": {
        "projectId": { "type": ["string", "null"] },
        "repoRef": { "type": ["string", "null"] },
        "workgroupId": { "type": ["string", "null"] },
        "paths": { "type": "array", "items": { "type": "string", "minLength": 1 } }
      }
    },
    "summary": { "type": "string", "minLength": 1, "description": "The distilled memory text: what happened / what is true." },
    "facts": {
      "type": "array",
      "description": "Structured graph facts (subject, predicate, object) when tier=graph — 'agent worked on file, PR fixed issue, skill helped task' (ch04). Each fact inherits the episode's validity interval unless it carries its own.",
      "items": {
        "type": "object",
        "properties": {
          "subject": { "type": "string", "minLength": 1 },
          "predicate": { "type": "string", "minLength": 1 },
          "object": { "type": "string", "minLength": 1 },
          "confidence": { "type": "number", "minimum": 0, "maximum": 1 },
          "validFrom": { "type": "string", "minLength": 1 },
          "validUntil": { "type": ["string", "null"] }
        },
        "required": ["subject", "predicate", "object"]
      }
    },
    "validFrom": { "type": "string", "minLength": 1, "description": "When the remembered fact became true in the world (event time, not ingest time)." },
    "validUntil": { "type": ["string", "null"], "description": "When the fact stopped holding; null = still valid. Required-but-nullable: open-ended validity is asserted, not defaulted. A retrieval layer must not serve episodes whose validUntil has passed as current facts (ch04 graph memory; stale-memory-pollution failure mode)." },
    "ingestedAt": { "type": "string", "minLength": 1, "description": "When the system learned/extracted the fact — the second temporal axis of the bi-temporal model. Enables 'what did we believe on date D' queries and audit." },
    "supersedes": { "type": "array", "items": { "type": "string", "minLength": 1 }, "description": "Episode ids this episode invalidates (contradiction/superseding logic: closing their validUntil is the runtime effect)." },
    "supersededBy": { "type": ["string", "null"], "description": "The episode that invalidated this one, when validUntil was closed by contradiction." },
    "extractedBy": {
      "type": "object",
      "description": "Provenance of the extraction (ch04 skill-creation pipeline step 2: Longshoreman extracts with source citations).",
      "properties": {
        "kind": { "enum": ["longshoreman", "self", "daemon", "operator"] },
        "agentNodeId": { "type": ["string", "null"] }
      },
      "required": ["kind"]
    },
    "citations": {
      "type": "array",
      "minItems": 1,
      "description": "Source citations back to transcript events, files, or claims. minItems 1 is the schema-level half of ch04's 'facts need validity intervals and sources'.",
      "items": {
        "type": "object",
        "properties": {
          "kind": { "enum": ["transcript-event", "file", "claim"] },
          "transcriptEventId": { "type": "string", "minLength": 1 },
          "span": { "type": "object", "properties": { "start": { "type": "integer", "minimum": 0 }, "end": { "type": "integer", "minimum": 0 } } },
          "fileRef": { "type": "string", "minLength": 1 },
          "claimRef": { "type": "string", "minLength": 1 },
          "sessionId": { "type": "string", "minLength": 1 }
        },
        "required": ["kind"]
      }
    },
    "sourcePayloadState": { "enum": ["present", "redacted", "deleted", "expired"], "description": "ch04 distilled-source contract: the state of the cited raw payload. When deleted/expired, sourceTombstone must carry the hash so the derivation stays verifiable-in-shape even though the payload is gone." },
    "sourceTombstone": {
      "type": "object",
      "description": "Present when sourcePayloadState is not 'present': the original event tombstone and hash, the derivation transform, and the degraded-confidence policy (ch04 deletion and derived memory).",
      "properties": {
        "originalEventHash": { "type": "string", "minLength": 1 },
        "derivationTransform": { "type": "string", "description": "How the digest/excerpt was derived from the deleted source." },
        "digest": { "type": ["string", "null"], "description": "Redacted excerpt or user-approved digest, when one was allowed to survive." }
      },
      "required": ["originalEventHash"]
    },
    "importance": { "type": "number", "minimum": 0, "maximum": 10, "description": "Retrieval-priority score; drives the forgetting policy tier." },
    "confidence": { "type": "number", "minimum": 0, "maximum": 1 },
    "forgettingPolicy": {
      "type": "object",
      "description": "How this episode decays (episodic-memory-algorithms skill: never_forget / half-life decay / session-scoped).",
      "properties": {
        "kind": { "enum": ["never-forget", "decay", "session-scoped"] },
        "halfLifeHours": { "type": ["number", "null"], "minimum": 0 }
      },
      "required": ["kind"]
    },
    "embeddingRef": { "type": ["string", "null"], "description": "Reference into the shared embedder index (versioned by model id, so re-embedding on model change is detectable)." },
    "retentionPolicyId": { "type": "string" }
  },
  "required": ["schema", "episodeId", "tier", "summary", "validFrom", "validUntil", "ingestedAt", "extractedBy", "citations", "sourcePayloadState"],
  "additionalProperties": true
}
